date,review
"September 3, 2020","The film is simple enough (and inoffensive enough) for children, yet possesses ample thematic depth and technical imagination to engage adults."
"September 3, 2020",It's performed with such consummate precision and showmanship that at times you would swear you were watching something with a heart.
"September 3, 2020",Mandatory moralizing mutes Mulan's majesty
"September 3, 2020",A lavish form of lip-service.
"September 3, 2020","Has the perfect set up and the correct approach to make Mulan the best of Disney's live-action remakes; unfortunately, never reaches any of the heights it has set for itself"
"September 3, 2020",Where Mulan falls short is in its emotional depth. There simply isn't much. This is the rare Disney film which may not send its viewers reaching for a tissue.
"September 3, 2020","Mulan is a cinematically stunning, live-action remake that accentuates action over heart, but the message it conveys, one of female strength and ingenuity as well as value, cannot be overlooked."
"September 3, 2020",It discards the stuff that didn't work and wasn't necessary the first time around keeps and improves upon the stuff that did work and the result is a film that is unquestionably better and more exciting to watch.
"September 3, 2020","Visually, the Mulan remake is not a masterpiece, but it gets the job done well in all the right places. The main way that the movie lags is how the personalities of the characters are watered-down from the original Mulan movie."
"September 3, 2020","It's a bold reinvention of the family-friendly Disney classic, and even if it falls short in certain areas, it's far more welcome than just another carbon copy."
"September 3, 2020",This is the best live action version to date.
"September 3, 2020",Easily the best of the Disney remakes so far. Director Niki Caro boldly evokes Chinese wuxia films to breathe new life to the legendary tale. [Full Review in Spanish]
"September 3, 2020",Liu brings the strength to the character that is needed for the film to work.
"September 3, 2020",An inferior reflection of the original.
"September 3, 2020","There are several volumes of sophisticated feminist theory at work, but, trust me, they are wholly in the service of a first-rate action-adventure film that puts characters ahead of spectacle."
"September 3, 2020","Its origins date back centuries, and its animated predecessor is beloved within the '90s Disney canon, but the latest version of Mulan couldn't be more relevant, vital, and alive."
"September 3, 2020",A transformative fairy tale with all of the high-flying swordplay of a wuxia epic.
"September 3, 2020","Mulan is a perfectly fine live-action adaptation, delivering some Disney magic and gorgeous visuals, but it's ultimately just an average action movie."
"September 3, 2020","Mulan is a solid Hollywood action movie with some Hong Kong flourish, and if it makes some 2020 kids discover real Kung Fu movies, that's great."
"September 3, 2020","Like the phoenix, 'Mulan' triumphantly rises and doesn't get lost in translation."
"September 3, 2020","You can feel the heart of it in every moment, even during the action scenes, which were handled with stunning precision."
"September 3, 2020","Now, this is my kind of Superhero movie. Disney's live action remake is more than Marvel-ous, it's a sweeping, inspirational and beautifully made film, one any family can and should enjoy."
"September 3, 2020","The colorful ""Mulan"" is striking in its visual beauty and production design. (Special kudos to Australian cinematographer Mandy Walker.) ""Mulan"" deserves to be seen on as big a screen as possible."
"September 3, 2020",Caro's Mulan carries the same emotional weight of the prior with a greater dramatic punch.
"September 3, 2020",Mulan is a soaring epic that will thrill global audiences.
"September 3, 2020","The actors capture the spirit of the beloved characters they are portraying... The action is spectacular, but the film feels rushed at times."
"September 3, 2020","Adds nothing new to the familiar story, but it's an engaging ride that never outstays its welcome and instead delivers a tale well told."
"September 3, 2020",Mulan is one of the few Disney re-makes that is overall a better film than the one it was based on.
"September 3, 2020","Mulan is not only the best Disney remake yet but perhaps better than the original. A bold statement, but one we stand by."
"September 3, 2020","While director Niki Caro significantly improves Mulan's classic story with her live-action narrative, the film's tone is inconsistent. It doesn't take enough risks to feel completely fresh."
"September 3, 2020","Its simplistic tale is effective, but lacks authenticity."
"September 3, 2020","Of all the live-action Disney adaptations, Disney's ""Mulan"" had the most potential. Instead, it ends up feeling like just another Disney movie, and not a very good one either."
"September 3, 2020","The international cast is nothing short of great, led by Yifei Liu's movie star turn as a boundaries-shattering, stereotype-defying hero-warrior for her time and for ours."
"September 3, 2020","Despite all my nit-picky complaints and how defensive I am about the 1998 Mulan and my initial low expectations of this live-action, I have to admit that I enjoyed it both as a standalone movie and as an homage to the animated film."
"September 3, 2020","[Director Niki Caro] never lets the battle scenes drown out the drama, finding inventive ways to keep the conflict visually interesting."
"September 3, 2020","Caro delivers a sumptuous event film with an excellent cast and newfound fierceness, giving the remake some additional heft as it details an unusual quest for identity and honor."
"September 3, 2020","Disney's new 'Mulan' presents a rousing role model for little girls ready to move beyond sleeping beauties, little mermaids, talking teapots and pumpkins that turn into coaches."
"September 3, 2020","""Mulan"" is good storytelling, if a little generic, with a solid femme theme that will entertain. It has been a long time coming, so expectations run high."
"September 3, 2020",A live-action remake not quite equal to an illustrious predecessor.
"September 3, 2020",A compelling and engaging adventure that represents not only an effective retelling of the 1998 film but arguably the best of the studio's animated-to-live action reconstructions.
"September 3, 2020","With sweeping scale, spectacular action, and a dynamic lead in Yifei Liu, Disney's live-action Mulan updates the original in surprising, mostly-effective ways while still maintaining the spirit of its predecessor."
"September 3, 2020","Mulan is spectacular below the line, with vivid colors and fight scenes, making for one of the more successful live-action remakes for Disney."
"September 3, 2020","While carried by a strong lead, Mulan stumbles through poor pacing, thin characters, and VFX issues that kept it an arm's length from the superior 1998 animated counterpart."
"September 3, 2020","Stuck in a battle of wills between an American sensibility, the Chinese legend, and the spectre of a previous film. This battle extends to every arena of the film with the exception of the acting and gorgeous costume work."
"September 3, 2020",Mulan was not as swift as the coursing river and did not have the strength of a raging fire.
"September 3, 2020","Brazenly pilfering the recent Skywalker saga (also owned by Disney), this Mulan has mutated into a slightly less interesting version of Daisy Ridley's Rey..."
"September 3, 2020","Martial-arts epic is more intense, violent than original."
"September 3, 2020","No music, no Mushu, no problem. Don't expect the animated Mulan and focus on the beautiful story of a father and warrior daughter who make mistakes and forgive each other."
"September 3, 2020","Yes, I missed the 1998 animated film's catchy music and talking animals - Eddie Murphy as a joking dragon called Mushu might be tough to swing in 2020 - but I was swept away by the breathtaking Chinese backdrops and high-stakes battles."
"September 3, 2020",Caro's take is one of the most beautiful films you'll see all year.
"September 3, 2020","My favorite addition to the movie is the character played by Gong Li, Xianniang. Between Xianniang and Mulan there's an antagonistic relationship, but also one of quasi mentorship. They are two women in a men's world. [Full Review in Spanish]"
"September 3, 2020","In Niki Caro's ""Mulan,"" that story elegantly and energetically moves forward, a timeless message made for right now."
"September 3, 2020","A big-budget, big-hearted adventure aimed directly at minority girls who all too often feel left out of the conversation."
"September 3, 2020","Stories about women bravely going against the cultural and social grain can be delectable catnip, and it's no different here."
"September 3, 2020","A tour de force! Nothing like the animated film, but that allows this Mulan to stand on its own. Gong Li's character is inspired. A strong script & excellent action!"
"September 3, 2020","Little girls might be better off sticking with the cartoon for now; but this opulent, ambitious production and Liu's focused, intrepid performance at its center, gives them something to grow into."
"September 3, 2020","A briskly efficient action movie of meticulous transnational appeal, one that is only now and then clearly working on tiptoes."
"September 3, 2020","Not exactly for the ages, but.. flamboyant and thrilling."
"September 3, 2020",It's best enjoyed if you're expecting a solid tween movie rather than a monumental cinematic landmark.
"September 3, 2020",An entertaining if straightforwardly glossy action-adventure from the Disney workshop.
"September 3, 2020",A beautifully layered and stunning martial arts adventure full of intricate action set pieces and a truly compelling premise.
"September 3, 2020","""Mulan"" is a spirit lifter, and though it doesn't arrive as planned, it could not arrive at a better time."
"September 3, 2020","Epic in scope and extravagant in its production design, Mulan would clearly have been a joy to experience in the theater, and it's a shame the world has changed so much over the last few months that audiences won't have that opportunity."
"September 3, 2020","While the film pays homage to the original, it stands on its own and feels more like a superhero movie about a young woman embracing her power than a film about a Disney princess."
"September 3, 2020","Is it going to save Hollywood? No, probably not. But it might save your Friday night, and that's not nothing."
"September 3, 2020","""Mulan"" isn't just the best adaptation Disney has done from its animated catalog, but one of the most resonant family dramas in a long time."
"September 3, 2020",Fuses Disney and wuxia values with a pretty good success rate.
"September 3, 2020","In the end, ""Mulan"" 2020 stands as an inspired oddity: A reenvisioned remake that improves on the original even as it owes everything to movies that have come before."
"September 3, 2020","This new iteration of the story is bold enough to go in a very different direction from the cartoon, take bigger risks in changing the source material and deliver some genuinely gorgeous cinematography and action."
"September 3, 2020","Technically, the movie is incredibly well made. I didn't have much to connect to on a story or character level."
"September 3, 2020","Liu has enough charisma for a lead performance, but the script gives her no depth and no meaningful relationships to work with."
"September 3, 2020","Despite its PG-13 rating, a rarity for a Disney release, Mulan feels like a watered-down version of a potentially captivating story."
"September 3, 2020","Mulan handily clears the bar set by live-action duds like The Lion King and Beauty and the Beast, but it still fails to recapture the magic of the movie it's adapting."
"September 3, 2020",Stunning deep reds from costumes and scenery almost make up for the bloodless swordplay and performances.
"September 3, 2020","The movie does frustratingly little with its noteworthy upgrades on the original, resulting in a version of the story that's only superficially more sophisticated."
"September 3, 2020",Walt Disney's Mulan remake perfunctorily recycles the worst aspects of the 1998 animated version and roundly fails to convincingly execute the few deviations that it does attempt.
"September 3, 2020","It's a remake of the 1998 film that reaches for bold choices, but feels too timid to ultimately make them worthwhile"
"September 3, 2020","It's fast-paced but the editing feels overdone, and there's a lack of heart as nothing is left to sit."
"September 3, 2020","If anything, Mulan looks nothing like a $200 million blockbuster, but an oddly sanitised B-movie that may well be the worst Disney live-action movie to date."
"September 3, 2020",She's the Chosen One-basically an East-Asian Harry Potter but instead of the Boy Who Lived she's the Girl Who Lived As A Boy For A Couple of Weeks.
"September 3, 2020","Though Liu holds her scenes well, we barely even know Mulan. She's a mere cipher-an emblem with which a huge studio can pat itself on the back, proud to offer this lukewarm plate of inspirational content before moving on to the next whatever."
"September 3, 2020",Mulan is a mixed bag that does some things incredibly well but most of the film occupies the middle of the road.
"September 3, 2020","At least fans will be able to be mildly disappointed in the comfort of their own homes, and be able to hit pause if they get a little drowsy."
"September 3, 2020","You don't realize how important those catchy songs are for character building until they're ironically ""cut"" from the film. Beautiful visuals and action can't ever replace good storytelling."
"September 3, 2020",[Its] respectful solemnity sometimes gets in the way of the just-shy-of-great remake Mulan's attempting to be.
"September 3, 2020",Lacks the unwavering compelling beats the original had but delivers an effective beautiful-looking drama with admirable heart and a unique serious tone.
"September 3, 2020","Broadly speaking, ""Mulan"" has largely honored the story while establishing its independence from the prior version, a delicate operation that succeeds in measured doses."
"September 3, 2020","While it's still unmistakably a Disney film, with its uncomplicated character arcs and picture-prettiness, it's also at its core a moving story of a young woman finding her strength."
"September 3, 2020","The Mulan remake walks on eggshells the entire time, juggling Caro's attempts to tell a cohesive story about identity with what was decided on by committee."
"September 3, 2020","Mulan does what it can to carve its own path (however familiar), and succeeds as more than just a reflection."
"September 3, 2020","Featuring colorful production and costume design to enhance the glorious setpieces, Mulan delivers a grand sense of adventure."
"September 3, 2020",Those hoping to see a new version of the animated movie will be disappointed. This Mulan has its own feel and texture.
"September 3, 2020",There's an undeniable soul to Mulan that is as rooted in Chinese culture and folklore as it is in the animated movie we've all come to love. It's truly the best of both worlds and I'm just disappointed I can't see it in theaters.
"September 3, 2020",Caro offers and accomplishes far more with Mulan than Mulan asks of her.
"September 3, 2020","Mulan's cast is filled with action powerhouses, but it doesn't quite utilize them in the way they should be. Yifei Liu is given a great spotlight as a leading talent, but her fellow cast members aren't afforded the same, which is bittersweet"
"September 3, 2020","While it's definitely a different experience than its predecessor, and maybe not for all little ones, you can't knock its fantasy style or inspiring adventure."
"September 3, 2020","Mulan isn't what we've come to expect from Disney's live-action remakes - it's far more sober, meditative, and refined."
"September 3, 2020",Disney's live action reimagining of their 1998 animated classic has epic sweep in a story of empowerment of the human spirit. A superb cast of Chinese stars makes this a welcome new take on a time-honored tale.
"September 3, 2020","Not everything works, but the crucial element - Mulan's relationship with her father - works wonderfully well."
"September 3, 2020",Mulan blends the Chinese legend with the Disney magic in a way that's respectful of both--but it's still very much a big screen film
"September 3, 2020","It is epic, it is breathtaking, it is grand."
"September 3, 2020","This is the first time I've seen one of these Disney remakes and thought it kind of, maybe had a reason to exist. It's not the soulless cash grab The Lion King and The Jungle Book were."
"September 3, 2020","Although Mulan doesn't recapture the magic of the original animated film, it at least gives the story a new voice. [Full Review in Spanish]"
"September 3, 2020","It's well-made and worth seeing, but it's so afraid of offending or being accused of being disrespectful that it never cuts loose and comes off as patronizing."
"September 3, 2020",Mulan updates its story for a slightly older audience and its battle scenes are dynamite.
"September 3, 2020","MULAN is brilliantly conceived and executed, along with being visually stunning. From the first frame until the last, it is a feast for the eyes woven through this amazing story of female power as a tribute to the rich beauty of Chinese culture."
"September 3, 2020","Niki Caro's boldly reimagined, battle-laden saga belies its Disney status and spotlights the multifaceted star power of Liu Yifei. The result is a live-action remake done right."
"September 3, 2020",Niki Caro breathes new life into a lush adaptation that follows the original without being dragged down by imitation.
"September 3, 2020","Mulan is a classic hero(ine)'s tale, exhilarating in its elaborate set pieces and large-scale ambitions even when the smaller human story within it sometimes falls short."
"September 3, 2020","This is a fresh, contemporary update to the original film even if it's not set in modern times."
"September 3, 2020","The mostly Chinese, English-fluent cast is brilliant. The film is also a great testament to the importance of family. Mulan's courage, dedication and intelligence should be an inspiration to young girls everywhere."
"September 3, 2020","Mulan serves as a decent live-action adaptation in terms of production quality and is bolstered by good performances, especially Liu Yifei's."
"September 3, 2020","A fun, albeit western, take on the classic Chinese Wu Xia genre."
"September 3, 2020","""Mulan"" might even inspire some kids to dip their toes into all that Asian cinema has to offer, which would be the best possible outcome. But something has to give in this blind fealty to the animated films, because it's getting in the way of greatness."
"September 3, 2020","This MULAN brings honor to us all with its beautiful cinematography, epic battle scenes, and a familiar, yet distinct tale."
"September 3, 2020","Caro's mirrored reflection of the 1998 masterpiece is smeared with the former's fingerprints, however, it still delivers uplifting, powerful potency."
"September 3, 2020","Why is it that so many of Disney's 'live action' remakes look so artificial, as if they've been mostly animated themselves?"
"September 3, 2020","Dazzling vistas, costumes, and effect, together with solid performances make up for a mostly straight-forward and not risky story, but one that sends good messages to kids nevertheless"
"September 3, 2020","One could complain that hardly a single frame feels original, but there's no denying how striking it all looks."
"September 3, 2020","2020's the perfect time for the tale of a hero who overcomes arbitrary, unfair restrictions and embraces her inner warrior."
"September 3, 2020","[I]f you strip away the things that make this such an unusual release in such an unusual year, you'll find a pretty good movie and one that approaches this story with heart and with fresh eyes."
"September 3, 2020","Unlike other Disney remakes, the issue with Mulan isn't that it hews to the formula too closely; it's that when this movie veers away from that formula, it tries to be something approaching a Marvel movie, and that's one crossover we still don't need."
"September 3, 2020",Mulan is by far the best of live-action Disney remakes as it takes a familiar story and twists it to create something with absolutely stunning cinematography and great fight scenes that truly makes it feel new and epic.
"September 3, 2020",Niki Caro brings the cultural ballad from a prior place of uneven song-and-dance lip service to a proper epic of empowering sweep where actions speak louder than words.
"September 3, 2020","Had me tearing up almost as much as every single time I've watched Caro's debut, Whale Rider."
"September 3, 2020",By far the best Disney live-action adaptation yet - though the bar wasn't exactly high.
"September 3, 2020","A beautiful retelling of the legend. Niki Caro's direction is splendid, while Liu Yifei is outstanding in the lead. Disney's best live-action adaptation to date. [Full review in Spanish]"
"September 3, 2020","""Mulan"" is a stirring and majestic adaptation of the cherished 1998 animated movie with spectacular action, remarkable visuals and heart to boot."
"September 3, 2020","A stunning and authentic new take on this iconic character, Mulan's villain is a weak point, but the uplifting, action-packed live-action remake is a journey worth taking and comes cheap at the price for $29.99."
"September 3, 2020","Extremely different from the original animated classic -- and that is OK. It is still a magical and powerful story filled with girl power, and it does the classic proud."
"September 3, 2020","I adored the animated Mulan, but the best I can say for this one is it's pretty enough, and watchable."
"September 3, 2020",A lot of humorless action with no songs.
"September 3, 2020","Though an improvement on the animated original and boasting splendid action scenes, Mulan is hampered by a flat, unemotive lead performance."
