date,review
"October 3, 2020","It may look like a film and quack like a film, but something's just not right with the new Mulan[.]"
"October 2, 2020","Mulan, as a character, is a wonderful role model for young girls and boys, too. She sticks to who she is and keeps her family values strong."
"October 2, 2020","The 2020 Mulan adaptation suffers from the problem that also plagued 2019's Dumbo (based on the 1941 children's classic), an update that felt more like a mummification."
"September 29, 2020","This Mulan is more straightforward than subtle. There are battles to be fought, an emperor to aid and a girl embracing her power. I wanted something more challenging, artful, disruptive."
"September 28, 2020","Cold, shallow and lackluster despite breathtaking cinematography and costume design."
"September 25, 2020","Liu pulls off all [her martial-arts] moves with vim and verve, and she conveys the essence of the story's defiantly disobedient rebel, too."
"September 22, 2020",Mulan is the best live-action film to come from Disney in a very long time.
"September 22, 2020",A live action mulan actually does lend itself to them doing some pretty great things but it's so similar to the animation with nothing that made the animation endearing [and] charming.
"September 22, 2020","Disney got it right with Mulan...this version is respectful, borrowing from the Chinese auteurs...no silly songs or talking dragon...terrific..."
"September 22, 2020","Unlike some movies in the $100-million club, Mulan puts the money on the screen."
"September 20, 2020","Although it's missing the charm and the magic of Disney's animated classic, its message of acceptance and empowerment is more vital than ever. [Full Review in Spanish]"
"September 17, 2020","The fight scenes were great, and it's entertaining...with some tone issues."
"September 17, 2020","It's trying to have its cake and eat it too, didn't quite stick the landing. But I liked it, and it will require more viewings..."
"September 17, 2020","The live-action Mulan remake has many promising parts, but fails to bring them together in a satisfying way."
"September 16, 2020","Perhaps a smidgen more humour wouldn't have gone amiss, but this is imaginative, eye-popping cinema, winningly open to the riches of Chinese culture and stirring in its feminist engagement."
"September 15, 2020","The film is drab, leaden and self-important. Stripped of songs, Mulan 2.0 lacks levity, spirit and is void of humour... Our heroine is difficult to warm to. She is presented as such a stolid ice maiden warrior there's no real vulnerability to her."
"September 15, 2020","The film is a visual masterpiece. Shot in New Zealand, it is full of rich colors and textures from start to finish. Every costume, set, and even prop is beautifully crafted, transporting viewers into a highly saturated version of sixth-century China."
"September 14, 2020","No Mushu, no songs, no problem. It's an empowering action spectacle that, although it stumbles out of the gate, is held aloft by its progressive depiction of life in the barracks..."
"September 13, 2020","Like its heroine, this is a film that forges its own path and is content to be its own magnificent creation."
"September 13, 2020","Mulan on Disney+ is not a musical and characters have been changed from the 1998 film, but it still honored the spirit of Ballad of Mulan as well as the animated feature."
"September 13, 2020","Disney's transparent desire to capitalise on the Chinese market - with a faithfully unquestioning stance - explains the watered-down adaptation, which appeases more than it excites."
"September 12, 2020","""Mulan"" raises the bar in Disney sequels. This one is outstanding. The strong, gorgeous storyline for Mulan, the female character, sets a wonderful role model for all girls worldwide."
"September 12, 2020",The transformation of a lighthearted coming-of-age story into a darker battle epic generally fails to take the material in a compelling new direction while subtly streamlining cultural specifics for mainstream consumption.
"September 11, 2020",The stunning natural vistas and jaw-dropping PG-13 action sequences make this a film every member of the family is likely to enjoy.
"September 11, 2020","Acceptably inoffensive, if less than wholly engaging. At least Liu's strong, stately Mulan is a wonderful role model for girls who aren't much interested in conformity and adhering to expectations."
"September 11, 2020","When the movie finds its groove and revels in the lush visuals and stirring heroics so widely associated with Mulan, all misgivings subside."
"September 11, 2020","While the ending feels flat and the villains lack, Mulan's strong second act pulls it ahead of the rest of Disney remake pack. It's almost perfect, but feels a bit too ""MCU"" for me."
"September 11, 2020","Director Niki Caro's modern update may take things in a different direction, but it makes Mulan a more empowering character. Thanks to her creative eye and Liu Yifei's star turn, Mulan is the best live-action Disney adaptation to date."
"September 11, 2020",Far from the most aesthetically bankrupt Disney movie of the last few years.
"September 11, 2020","It's exactly what you'd imagine a Mouse House wu xia pic might be: turning up to the party as handsomely crafted as money can buy, but lacking the innate poetic grace and artistry of a King Hu or Zhang Yimou epic."
"September 11, 2020","A movie of impressive scale and clear visual command, an effort that, for my money, far surpasses its animated predecessor."
"September 11, 2020","Mandy Walker's cinematography is strong enough to make you regret that this couldn't viably be released in cinemas, and the name Chinese cast is pretty good too, and yet, somehow, it doesn't quite work."
"September 10, 2020","While glorious to look at, the movie still feels slightly hollow. All the right pieces are there, but an emotional connection to the characters is lacking."
"September 10, 2020","Director Niki Caro expertly balances the drama, humour, adventure and action, creating a thrilling big-screen epic with potent emotional resonance and lots of female power."
"September 10, 2020","The whole film has a muscular visual flair, with sweeping camera movements and cast-of-thousands set pieces that make this Chinese legend feel truly epic."
"September 10, 2020","This Mulan may have been made for the big screen, but it is impressive anywhere."
"September 10, 2020","The best scenes, as they should be, are between Mulan and her fellow war hero father, played by Tzi Ma of The Farewell. Their relationship provides the beating heart of this gritty fairy tale."
"September 10, 2020","The movie itself feels like an anticlimax: Mulan is merely a serviceable film that's rather easy to forget. It does not live up to the expectations placed on it, nor does it make a compelling argument against its earliest critics."
"September 10, 2020",Mulan certainly enriches Disney's cultural canon.
"September 10, 2020","A homage to family, feminism, honor, leadership & the joy of being true to yourself. With tributes to Kurosawa, the samurai, martial arts and the mystery of China. Wonderful."
"September 10, 2020","While it's not a bad film, Disney should've stuck to their word and done a telling of the original story, which this was not."
"September 9, 2020",I think [Yifei Liu] did a really great job as Mulan.
"September 9, 2020",Overall it was a lot of fun.
"September 9, 2020","Popcorn cinema at best, nothing more. [Full review in Spanish]"
"September 9, 2020","Draws a lot from [China's] culture, without respecting and honoring it properly. [Full review in Spanish]"
"September 9, 2020","By now we've seen too many authentic, dynamic Chinese action movies, especially Zhang Yimou's recent Shadow and The Great Wall, to accept this dross."
"September 9, 2020","A live-action remake as flat as the surface of a wooden sword, which is immediately weighed down by a dull and predictable narrative that quickly affects the parable about identity, gender equality and female empowerment. [Full review in Spanish]"
"September 9, 2020","With Mulan, Disney shoots for more than a shot-for-shot remake of the past. The result is a little clunky at times, but compelling enough to justify its existence."
"September 8, 2020","Instead of a normal girl, this Mulan is an infallible human weapon at the service of the Chinese empire. [Full Review in Spanish]"
"September 8, 2020",So instead of doing a play by play remake of the animated film they tossed out the songs and the Eddie Murphy type comedy. Good for them for sticking with an epic adventure movie that promotes girl power.
"September 8, 2020","Mulan's unnecessary changes and additions both pad the runtime and weaken its protagonist, resulting in an overworked and underbaked slog of a film that does the original a true injustice."
"September 8, 2020","Mulan turns out to be a pleasant surprise -- that Disney's creative capacity for thematic and visual reimagination is being consistently expanded by its feminist projects, and also that the film is a potent antithesis to its predecessors."
"September 8, 2020","This is a bland retelling of the Chinese folktale, wavering between wanting to set its own identity and capturing the nostalgia for the 1998 animated version."
"September 8, 2020","In short, it's 'just fine', and you'll likely feel just as you did after Aladdin, Beauty and the Beast or The Lion King: wishing you were watching the original."
"September 8, 2020","This 2020 Mulan is a brave attempt at retelling the original folktale. Essentially, it removes everything the Western audience has known and loved about Mulan and dares them to find something new to appreciate, and it works."
"September 8, 2020","The body piercings via arrows and swords will definitely give the littlest ones nightmares. Heck, they kept me up all night. Luckily, all I had to do was go to Disney Plus, click on ""Mulan,"" and in no time I was fast asleep."
"September 7, 2020",Niki Caro superbly directs the best of the Disney live action remakes to date. [Full review in Spanish]
"September 7, 2020",Mulan's story always did lend itself to spectacle. ... But most significantly -- and discomforting -- [this version] gives Mulan superpowers. ... It's a shame that someone decided she needed a sprinkling of pixie dust.
"September 7, 2020","The Disney remakes have been far more miss than hit, and Mulan is one of their most massive misses."
"September 7, 2020","Disney keeps making these shot-for-shot remakes and expecting everyone not to care or notice that the magic, themes, and character development that made the animated Mulan iconic are completely missing here..."
"September 7, 2020","A grown-up adaptation. Deals with traditional values, but also progressively empowering... full potential of individual when being true to oneself, and for society to take a hard look and make changes for the greater good. No courage without fear indeed."
"September 7, 2020",Disney is offering young viewers a handy introduction to epic film-making.
"September 7, 2020","Everything about this Mulan is ironic accidentally. Whatever its intentions, its execution and the circumstances of its creation are in opposition to them."
"September 6, 2020",It would be difficult to concoct a less imaginative remake.
"September 6, 2020","Exciting, action-packed live-action remake"
"September 6, 2020","[It] improves on the story in some ways, but falls short in presenting a masterful, wire-fu epic."
"September 6, 2020","The combat set pieces are terrific, the scale of the storytelling is epic."
"September 6, 2020","It's on one-hand a harmless film and not offensively awful, but it does not live up to its potential, and makes a lot of thoroughly weird decisions."
"September 6, 2020",It's a wondrous thrill to see a Disney live-action remake take a bold stance and offer something different than a pointless rehashing.
"September 6, 2020",Mulan is an auspicious blend of battle epic and fairy tale that ought to inspire a new generation of would-be warriors.
"September 6, 2020","Overall, Mulan aims to be a sweeping, cinematic adaptation of an animated classic. But the film might miss that mark for adult audiences. Despite this, the film has a place in our discussions about positive representation."
"September 5, 2020","I'm as athletic as a bed sock but, for so many reasons, this movie made me want to do backflips."
"September 5, 2020","It's thrilling action, but there's a strong sense it would all probably look better on a cinema screen."
"September 5, 2020","[T]he action isn't so much balletic as epically generic: lots of sweeping camera moves, but no understanding of how to use them to advance the story."
"September 5, 2020","""Mulan"" is visually gorgeous with massive battle sequences and moments that rival most any martial arts epics."
"September 5, 2020","That magic isn't present here, and the action scenes don't achieve lift-off."
"September 5, 2020","The story's mystical elements, notably a fierce, shape-shifting sorceress, are handled deftly; the film never overdoses on CGI."
"September 5, 2020","Loyal, brave, and true to the spirit of both the original animated film and the legend that inspired it, but doesn't always reflect the best qualities of either one."
"September 5, 2020","Talking animals and slapstick silliness are very much out and stiff-lipped themes of family, duty and honour are in."
"September 5, 2020",I admire Disney for trying to do something different -- they didn't just make a shot-for-shot remake of the original movie -- but all of the choices they made were inferior to the original film.
"September 5, 2020","While these Disney remakes may not sit quite right with some fans of the originals, there's no denying that they're good business. And sometimes - as is the case of Mulan - they're not just good business, but good movies."
"September 5, 2020","I think I know why Disney decided to stream the movie rather than wait for theaters to open across the country. There had to have been a recognition that for all its $200,000,000 budget and promotional possibilities, this ""Mulan"" is remarkably ordinary."
"September 5, 2020",This is ultimately a father and daughter story... That emotional story gets me every time.
"September 5, 2020",Mulan is the first Disney live action remake that finds a successful balance between comfortingly familiar and refreshingly new.
"September 5, 2020","It's one of Disney's very best adaptations of their animated classics, a re-telling wise enough to keep the best parts of its predecessor while largely making the film feel very much its own achievement."
"September 5, 2020","It is a fantastic companion piece to the animated film, but also stands up as a great action movie on its own."
"September 4, 2020","Mulan is definitely one of, if not maybe the, best of Disney's live-action adaptations ... Taking the original and breathing a refreshing life into the story so it becomes its own entity."
"September 4, 2020","Dishonor on you, dishonor on your cash cow, dishonor on all these Disney remakes. Mulan deserves better."
"September 4, 2020",Satisfying but bumpy.
"September 4, 2020","[Director Niki Caro] has staged some impressive, if largely bloodless battle sequences, and demonstrated that watching leading lady Yifei Liu wielding a sword and riding a horse can be just as engaging as watching a cartoon dragon."
"September 4, 2020","Gorgeous as the sets and cinematography can occasionally be, the film still feels safely engineered to be for American audiences."
"September 4, 2020",Disney's live-action Mulan has its heart in the right place but can't quite capture the magic of its animated predecessor.
"September 4, 2020","Nostalgia is a double-edged sword that cuts both ways: it makes us excited to see the newest version, while carrying the albatross of constant comparison."
"September 4, 2020",Mulan is the hero kids need in 2020. It challenges them instead of talking down to them and is one of the better live action Disney reboots.
"September 4, 2020","The best live-action Disney reboot, period. Thrilling battles sequences, stunning visuals, and a stellar cast including an excellent Yifei Liu in the title role."
"September 4, 2020","Mulan lacks the warmth, true inspiration , emotional connection and poignancy a filmgoer should expect from Disney."
"September 4, 2020","Mulan, however, suffers of the same affliction as other Disney live-action remakes. It's profoundly risk-averse. So you get stunning productions with no narrative edge"
"September 4, 2020","Liu is an emotional blank and between rip-roaring action scenes, sometimes the movie feels like a glum slog. Still, it's a stylish war film with a marvelous sense of place."
"September 4, 2020","This Mulan is like a dream: Curious, beautiful and instantly forgotten."
"September 4, 2020","While it doesn't quite hit a high-water mark of female-centric adventures, it's nonetheless a strong story with a powerful message for women, warriors and those who are both."
"September 4, 2020","It might have been an excellent reinterpretation, were it not so heavy-handed and, well, Disney-fied. But what remains bears minimal discernible relationship to the original, while reading too much like a basic Marvel film."
"September 4, 2020","Of the 12 live-action remakes that Disney has produced over the last decade, Mulan is easily the least Disneyesque of the bunch. That's not to say the reimagining of the 1998 animated feature is not a beautiful spectacle to behold."
"September 4, 2020","When the swords are drawn and the arrows begin to fly, there's a gem of something special to be found in Mulan."
"September 4, 2020","Apart from the lack of singing, romance, comedy and a mouthy dragon, this is just like the original. You might wonder what's left. Well, $200 million buys a lot of scenery and sets and quite a few stars. This new version has spectacle in mind."
"September 4, 2020","Caro's remake hits the elements of a good Wuxia movie, including gravity-defying stunts, striking colors and gorgeous natural settings. It also goes deeper on the empowering elements of the original."
"September 4, 2020","Niki Caro has finally topped her 2002 coming of age tale Whale Rider. With a superb cast, Mulan is a masterful live-action version of the 1998 animated hit."
"September 4, 2020","While Mulan has some wonderful action sequences, the stiff story and lack of charm leaves much to be desired."
"September 4, 2020","It's far more dynamic and alive than most of the other remakes, and it honors the spirit of the original while heading forward into some interesting, modern new directions."
"September 4, 2020","It's an efficient retelling of a tale about a young Chinese woman discovering her power -- affecting at times, occasionally quite lovely, but earnest, often clumsy, and notably short on joy."
"September 4, 2020",A surfeit of talent and good intentions only go so far when your lead character ends up less flesh and bone than her cartoon predecessor.
"September 4, 2020","Mulan is more than just a spectacle; it's a moving, rousing piece of art."
"September 4, 2020","Directed Niki Caro, working from a screenplay by Rick Jaffa & Amanda Silver and Lauren Hynek & Elizabeth Martin, strikes exactly the right balance between emotion and action."
"September 4, 2020","The best I can think of for an explanation about the overall slogginess here is that the concept of Mulan really, really needs songs and talking animals."
"September 4, 2020","Director, Niki Caro, has created an epic film, with meticulously choreographed stunts and battle scenes shot with precision on both geometrically defined and lush locations."
"September 4, 2020",Liu carries the film fearlessly - whether it's the quieter emotional moments or being badass on the battlefield.
"September 4, 2020","I enjoyed Mulan, but I couldn't avoid the sense of disconnect inherent in watching a wuxia-style period piece with Chinese actors speaking accented English dialogue."
"September 4, 2020",A robust period epic with visual grandeur to spare... [director Niki Caro] fashions an epic that keeps the Disney spirit while standing out as well.
"September 4, 2020","Its roughly 900-year-old hero remains inspirational. As the wise old Emperor said in the original film, ""You don't meet a girl like that every dynasty."""
"September 4, 2020","Don't expect to sing along with catchy songs but expect to fall in love with Mulan all over again. The film is emotional, beautifully shot, and all-around enjoyable."
"September 4, 2020","If someone were to do a shot every time a character mentions ""honor,"" they would surely die of alcohol poisoning before the credits roll under a new recording of ""Reflection"" from Christina Aguilera."
"September 4, 2020",Mulan delivers a straightforwardly heroic narrative of a capable woman battling her way to respect. It just doesn't have much else to add.
"September 4, 2020","Disney's ongoing foray into rehashing its existing classic properties as Live-Action remakes has seemingly done the unlikely with ""Mulan,"" namely by giving its new incarnation a reason to exist."
"September 4, 2020","It's an amazing cinematic achievement, buoyed by amazing action sequences"
"September 4, 2020","Even the movie's stagiest moments seem perfectly suited to the spectacle Caro creates; stunning vistas of sand dunes, majestic snow-capped mountains cities popping with colour and scenes of jaw-dropping choreographed battles."
"September 4, 2020",Caro's Mulan is a spectacle and it's too bad it won't be shared across big screens.
"September 4, 2020","Mulan is a visually stunning cornucopia cinematic feast with breakout stars who takes no prisoners in the form of Yifei Liu and Gong Li. Kudos to Niki Caro for bringing a mature, fresh spin to a classic beloved tale."
"September 4, 2020","An astonishing update to the animated classic, Mulan is a colourful and vibrant movie with bombastic battles and heroine with a ferocious heart. Entertaining for all."
"September 4, 2020",Mulan sidesteps the usual shot-for-shot route that many of its predecessors took.
"September 4, 2020","Niki Caro does a fine job with drama and action, but I just wonder what the final product would have looked like if an Asian director and writers-under Disney's guidance-had been at the helm."
"September 4, 2020","For a film with so much at stake, Mulan never feels epic, but it does succeed as a story of a young woman courageously defying cultural and social expectations."
"September 4, 2020",It is no longer easily recognisable as a family film. Nor is it a grown-up action film.
"September 4, 2020","It's a step-up effort for a Disney's live-action remake over the tepid triple-whammies of last year's ""Dumbo"", ""Aladdin"" and ""The Lion King""."
"September 4, 2020","The theme of being true to yourself shines through, and there is much to enjoy even if the movie doesn't quite have the emotional pull to provoke laughter and tears."
"September 4, 2020","With both respect to what's done and commitment on what can be done, this Mulan is an epic delight - as much as the 1998 film and as its own entity."
"September 4, 2020",[Mulan] lives up to the themes of its predecessor while also cutting its own forcefully dynamic path.
"September 4, 2020",There is something about the reality of Mulan being a real-life teenage girl that changes the dynamic of the whole experience. Director Niki Caro never mocks... never goes for the easy gag.... never forgets that her Mulan is a real life young woman.
"September 4, 2020","[T]he film tells a fine, rich, and empowering story, respectful of its characters and a tradition of filmmaking that matches its tale quite well."
"September 4, 2020","Mulan cracks the code of being an excellent remake, while still honoring fan favorite moments of the original film. Although not a musical, the score still packs a punch."
"September 4, 2020","Closer to director Nikki Caro's touching, both mythic and intimate ""Whale Rider"" than it is to the animated musical with Eddie Murphy as a quippy little dragon."
"September 4, 2020","Director Niki Caro ... handles the fight scenes ... and dramatic moments with equal aplomb, though some of the additional effects ... feel less well-designed."
"September 4, 2020","I enjoyed and was entertained by this offering from start to finish. I imagine many impressionable young girls will be similarly entranced. (Full Content Review for Parents - Violence, etc. - also Available)"
"September 4, 2020","...a fleet-footed, live-action adaptation of the 1998 animated hit. But this wartime, period-set, epic fantasy isn't the transcendent classic it might have been."
"September 4, 2020","With its CROUCHING TIGER, HIDDEN JEDI meets YENTL shtick, is a really great riff in what came before while unafraid to do things in new way."
"September 4, 2020",Won't satisfy the musically-inclined but it's more traditional mindset means it can stand on its own.
"September 3, 2020","A wonderful piece of filmmaking, with absolutely gorgeous choreography, elegant design, a euphoric score and impeccable cinematography... a respectful, traditional take on the tale quite easily makes this one of Disney's best remakes to date."
"September 3, 2020","The visuals are the best thing about the film, the spectacle a dazzling distraction from some of the weaker elements of storytelling and performance."
"September 3, 2020",Little girls everywhere will be inspired.
"September 3, 2020","This live-action version of the 1998 hand-animated feature is stunning to take in, most notably the set design and stunts, though the leap to a more epic and spectacular format has nipped some of the wonderment and depth of character."
"September 3, 2020",I am extremely impressed with the work that Niki Caro delivers here.
